{
  "schemaVersion": "1.0.0",
  "id": "quest-rule-synthetic",
  "version": "1.0.0",
  "rulesetId": "ruleset-synthetic",
  "displayName": "Synthetic bonus quest",
  "status": "PUBLISHED",
  "confidence": "VERIFIED",
  "seriesId": "quest-series-synthetic",
  "stage": 1,
  "type": "BONUS_QUEST",
  "minimumLevel": 220,
  "eligibleClassIds": ["class-synthetic"],
  "eligibleEvolutionIds": ["evolution-synthetic"],
  "prerequisiteQuestIds": [],
  "evidenceRefs": ["evidence-synthetic-001"],
  "testCaseRefs": ["quest-case-synthetic-001"]
}